Safe Running Techniques,1,1A,2019-06-16 09:00:00,2019-06-16 11:30:00
Stationary vs Road Biking,1,1B,2019-06-16 09:00:00,2019-06-16 11:30:00
Swimming for Endurance,1,1C,2019-06-16 09:00:00,2019-06-16 11:30:00
Weight Lifting Basics,2,1A,2019-06-16 13:00:00,2019-06-16 16:00:00
Calisthenics for Strength,2,1B,2019-06-16 13:00:00,2019-06-16 16:00:00
Yoga for Building Muscle,2,1C,2019-06-16 13:00:00,2019-06-16 16:00:00
Nutrition Plan Based on your Personal Needs,3,1A,2019-06-17 09:00:00,2019-06-17 11:30:00
The Role of Proper Rest,3,1B,2019-06-17 09:00:00,2019-06-17 11:30:00
Keeping your Body Healthy through Mobilization,3,1C,2019-06-17 09:00:00,2019-06-17 11:30:00
